id,data_provider,country,partner_product_category,product_category,product_category_id,brand,year_of_manufacture,product_age,repair_status,repair_barrier_if_end_of_life,group_identifier,event_date,problem
repconn_2113,Repair Connects,BEL,Vacuum,Vacuum,34,Philips,"","",Fixed,"",Repair Café Gent,2022-03-02,Het toestel werkt eigenlijk nog perfect maar de stroomkabel geeft slecht contact waardoor het toestel heel de tijd uitvalt en daardoor eigenlijk niet meer bruikbaar is
repconn_2114,Repair Connects,BEL,Vacuum,Vacuum,34,Nilfisk,2016,6,Fixed,"",Repair Café Gent,2022-06-08,"Als je het toestel aanzet, sputtert de motor en valt onmiddellijk uit. Na X-aantal keer proberen lukt het wel. Het lijkt een vals contact"
repconn_2115,Repair Connects,NLD,Vacuum,Vacuum,34,Dyson,2017,4,Fixed,"",Foenix Repair Café Apeldoorn,2021-06-14,Hij werktte prima tot ik m weer wilde aanzetten plofte hij en deed niks meer gaat niet aan
repconn_2116,Repair Connects,BEL,Vacuum,Vacuum,34,Dyson,"","",Repairable,"",Repair Café Gent,2022-06-26,De batterij lijkt niet meer voldoende op te laden. Het apparaat stopt na een minuut.
repconn_2117,Repair Connects,NLD,Vacuum,Vacuum,34,Miele,"","",Fixed,"",Foenix Repair Café Apeldoorn,2022-05-30,"Werkte eerst prima, nu is het contact tussen het snoer en de motor kapot"
repconn_2118,Repair Connects,NLD,Vacuum,Vacuum,34,AEG,2012,10,Fixed,"",Foenix Repair Café Apeldoorn,2022-06-14,Start niet meer
repconn_2119,Repair Connects,BEL,Vacuum,Vacuum,34,Philips,2010,11,End of life,"",Maakbaar Leuven,2021-10-23,Vochtig geweest werkt niet meer
repconn_2120,Repair Connects,NLD,Vacuum,Vacuum,34,Dyson,2019,3,Fixed,"",Foenix Repair Café Apeldoorn,2022-06-07,"Filter met water gereinigd conform instructie. Daarna te snel teruggezet, voordat het filter al droog was. Stofzuiger doet nu niets meer."
repconn_2121,Repair Connects,BEL,Vacuum,Vacuum,34,Bosch Steelstofzuiger,2019,2,Repairable,"",Repair Café Gent,2021-07-06,kan niet meer opgeladen worden.
repconn_2122,Repair Connects,BEL,Vacuum,Vacuum,34,Karcher,2019,3,End of life,Item too worn out,Maakbaar Leuven,2022-07-11,"Battery is not charging anymore, does also not work when connected to power"
repconn_2123,Repair Connects,BEL,Vacuum,Vacuum,34,Dyson,"","",End of life,Item too worn out,Maakbaar Leuven,2022-07-09,Toestel gereinigd met water en sindsdien werkt hij niet meer
repconn_2124,Repair Connects,NLD,Vacuum,Vacuum,34,Miele,"","",Fixed,"",Foenix Repair Café Apeldoorn,2022-06-08,"De moter begon een vreemd geluid te maken, er kwam sto en een beetje rook uit en veel lawaai meteen uitgezet. De volgende dag de zak en filters verwijderd buiten weer aangezet. In eerste instantie dacht ik: niets aan de hand zal wel sof zijn geweest tot het toch weer begon. Moter draait nog wel"
repconn_2125,Repair Connects,BEL,Vacuum,Vacuum,34,Dyson,"","",Repairable,"",Maakbaar Leuven,2022-03-15,Verbrande reuk en werkt niet meer
repconn_2126,Repair Connects,BEL,Vacuum,Vacuum,34,Nilfisk,"","",Fixed,"",Maakbaar Leuven,2020-06-06,Schakelaar werkt niet meer
repconn_2127,Repair Connects,BEL,Vacuum,Vacuum,34,pHILIPS,"","",End of life,Item too worn out,Repair Café Zuidrand,2021-09-07,Riekt verbrand bij opzetten. Ik ben bang dat de motor verbrand is en hij onherstelbaar is maar omdat ik juist een nieuwe borstel gekocht heb hoop ik op het tegendeel!
repconn_2128,Repair Connects,BEL,Vacuum,Vacuum,34,Nilfisk,2004,18,Fixed,"",Maakbaar Leuven,2022-07-03,Bij het stofzuigen leek er plotseling iets in het toestel zelf los te zijn gekomen en begon het naar verbrand te ruiken (+ het automatisme van het oprolsnoer doet het niet meer)
repconn_2129,Repair Connects,BEL,Vacuum,Vacuum,34,Rowenta,"","",Fixed,"",Maakbaar Leuven,2020-06-07,"Het stukje slang dat tussen het mondstuk en de stofzuiger zelf zit, is kapot. Er zit een grote opening in de plastic slang waardoor het vuil dat opgezogen wordt, niet meer naar de 'vergaarbak' gaat en grotendeels weer opnieuw uitgeblazen wordt."
repconn_2130,Repair Connects,BEL,Vacuum,Vacuum,34,Philips,"","",Repairable,"",Maakbaar Leuven,2020-06-08,"De stofzuiger geeft geen teken van leven meer...\nDit is het exacte model, aangekocht op 9/9//2016\nhttps://www.bol.com/nl/p/philips-powerpro-ultimate-fc9919-09-stofzuiger-zonder-zak/9200000048043213/?country=BE"
repconn_2131,Repair Connects,BEL,Vacuum,Vacuum,34,Electrolux,2019,2,End of life,Item too worn out,Maakbaar Leuven,2021-10-18,"De oplader werkt niet meer. Bij het insteken in het stopcontact, was er een kleine vonk. Probleem met transformator? ( Stopcontact en stofzuiger werken nog.)"
repconn_2132,Repair Connects,BEL,Vacuum,Vacuum,34,Miele,"","",Repairable,"",Maakbaar Leuven,2022-08-25,"I don't know, I got it broken."
repconn_2133,Repair Connects,NLD,Vacuum,Vacuum,34,Dyson,"","",Fixed,"",Foenix Repair Café Apeldoorn,2022-06-14,Hij laadt niet meer op.
repconn_2134,Repair Connects,BEL,Vacuum,Vacuum,34,Miele,"","",Repairable,"",Maakbaar Leuven,2022-03-10,"Ik geloof dat er stof in de motor terechtgekomen is en nu werkt deze niet meer. Van zodra ik het toestel aanzet, ruikt het verbrand."
repconn_2135,Repair Connects,BEL,Vacuum,Vacuum,34,Bosch,"","",Repairable,"",Maakbaar Leuven,2022-07-19,"Ik krijg de lamellenfilter niet verwijderd om te reinigen. Zolang het niet gereinigd wordt, werkt stofzuiger niet."
repconn_2136,Repair Connects,BEL,Vacuum,Vacuum,34,aeg,"","",End of life,Item too worn out,Maakbaar Leuven,2023-01-21,"het toestel werkt niet meer. Telkens als ik het aanzet, springt de zekering."
repconn_2137,Repair Connects,BEL,Vacuum,Vacuum,34,Dyson,2016,6,Fixed,"",Repair Café Gent,2022-02-14,Motor slaat aan maar maakt na 30 seconden een scherp geluid
repconn_2138,Repair Connects,NLD,Vacuum,Vacuum,34,Nilfisk,"","",Fixed,"",Foenix Repair Café Apeldoorn,2022-06-20,Stofzuiger gaat helemaal niet meer aan
repconn_2139,Repair Connects,BEL,Vacuum,Vacuum,34,Bosch,"","",Repairable,"",Maakbaar Leuven,2022-08-18,Twee wieltjes kapot
repconn_2140,Repair Connects,BEL,Vacuum,Vacuum,34,AEG CX7,2018,3,Fixed,"",Repair Café Virtuel Wallonie/Bruxelles,2021-07-02,L'interrupteur ne fonctionne plus et par conséquent le moteur ne se met pas en route. Par contre l'autre élément ramasse-miettes avec son interrupteur indépendant se met en marche et est détachable.
repconn_2141,Repair Connects,BEL,Vacuum,Vacuum,34,Hoover,2017,5,Fixed,"",Maakbaar Leuven,2022-03-02,The electric plug no longer works
repconn_2142,Repair Connects,BEL,Vacuum,Vacuum,34,Neato,"","",Repairable,"",Maakbaar Leuven,2023-02-18,"Robotstofzuiger maakt veel lawaai, maar ik heb de indruk dat er een wieltje niet goed ronddraait of niet goed aangedreven wordt?"
repconn_2143,Repair Connects,NLD,Vacuum,Vacuum,34,Miele,"","",Fixed,"",Foenix Repair Café Apeldoorn,2022-07-08,de moter werkt niet meer.
repconn_2144,Repair Connects,BEL,Vacuum,Vacuum,34,Dyson,"","",Fixed,"",Maakbaar Leuven,2022-04-10,Het start niet. Zelfs met nieuwe batterij. Batterij is ook volledig geladen.
repconn_2145,Repair Connects,BEL,Vacuum,Vacuum,34,Quigg,2022,0,End of life,Item too worn out,Maakbaar Leuven,2022-08-13,Het toestel laat niet meer op.
repconn_2146,Repair Connects,BEL,Vacuum,Vacuum,34,Kärcher,2016,6,Fixed,"",Maakbaar Leuven,2022-01-31,Na 2 sec. hoor je een plof in het deksel en stopt hij met zuigen.
repconn_2147,Repair Connects,BEL,Vacuum,Vacuum,34,miele,"","",Fixed,"",Repair Café Waregem,2023-02-10,de aanleg knop werkt niet meer
repconn_2148,Repair Connects,BEL,Vacuum,Vacuum,34,max force,2020,3,Repairable,"",Repair Café Waregem,2023-02-10,de aan knop werkt niet meer
repconn_2149,Repair Connects,BEL,Vacuum,Vacuum,34,Dyson,"","",Repairable,"",Repair Café Gent,2022-02-10,"Motor slaat niet meer aan,"
repconn_2150,Repair Connects,BEL,Vacuum,Vacuum,34,Primo,"","",Fixed,"",Maakbaar Leuven,2022-07-07,Zuigt niet meer goed af
repconn_2151,Repair Connects,BEL,Vacuum,Vacuum,34,AEG,"","",Fixed,"",Maakbaar Leuven,2022-07-08,"REPAIR & WIN actie - repareer en houd/geef weg: 1 van de 6 toestellen ontvangen van IXINA Leuven, die de rechtmatige eigenaars na een commerciële actie niet zijn komen ophalen. De toestellen gaan jammer genoeg niet meer aan doordat ze te lang hebben stilgelegen."
repconn_2152,Repair Connects,BEL,Vacuum,Vacuum,34,AEG,2015,7,Fixed,"",Repair Café Gent,2022-03-27,Zuigt niet goed meer.
repconn_2153,Repair Connects,BEL,Vacuum,Vacuum,34,Black et Decker,1999,23,Repairable,"",Repair Café Virtuel Wallonie/Bruxelles,2022-01-10,"Je m’en suis pas servie depuis longtemps, il ne s’allume plus."
repconn_2154,Repair Connects,BEL,Vacuum,Vacuum,34,Nilfisk,"","",Repairable,"",Repair Café Gent,2021-06-21,"Slecht contact in het elektrisch snoer of in de stekker. Start vaak niet, na wat gewiebel in het stopcontact lukt het dan wel voor een tijdje. Maar even goed valt hij meteen weer uit wegens geen stroom."
repconn_2155,Repair Connects,BEL,Vacuum,Vacuum,34,AEG,"","",Fixed,"",Maakbaar Leuven,2022-07-08,"REPAIR & WIN actie - repareer en houd/geef weg: 1 van de 6 toestellen ontvangen van IXINA Leuven, die de rechtmatige eigenaars na een commerciële actie niet zijn komen ophalen. De toestellen gaan jammer genoeg niet meer aan doordat ze te lang hebben stilgelegen."
repconn_2156,Repair Connects,BEL,Vacuum,Vacuum,34,AEG,"","",Fixed,"",Maakbaar Leuven,2022-07-08,"REPAIR & WIN actie - repareer en houd/geef weg: 1 van de 6 toestellen ontvangen van IXINA Leuven, die de rechtmatige eigenaars na een commerciële actie niet zijn komen ophalen. De toestellen gaan jammer genoeg niet meer aan doordat ze te lang hebben stilgelegen."
repconn_2157,Repair Connects,BEL,Vacuum,Vacuum,34,Miele,2016,6,Fixed,"",Repair Café Aalter,2022-03-18,Werkt gewoon niet meer
repconn_2158,Repair Connects,BEL,Vacuum,Vacuum,34,AEG,"","",Fixed,"",Maakbaar Leuven,2022-07-08,"REPAIR & WIN actie - repareer en houd/geef weg: 1 van de 6 toestellen ontvangen van IXINA Leuven, die de rechtmatige eigenaars na een commerciële actie niet zijn komen ophalen. De toestellen gaan jammer genoeg niet meer aan doordat ze te lang hebben stilgelegen."
repconn_2159,Repair Connects,BEL,Vacuum,Vacuum,34,AEG,2018,4,Fixed,"",Maakbaar Leuven,2022-09-10,"it worked perfect, but the cable cord is damaged which often gives no power to the vacuum cleaner"
repconn_2160,Repair Connects,BEL,Vacuum,Vacuum,34,Dyson V8 Absolute +,2016,6,Repairable,"",Maakbaar Leuven,2022-10-22,"altijd prima gewerkt, maar nu is de batterij super snel plat, echt al slechts na 2 minuten en vroeger was dit veel, veel langer..."
repconn_2161,Repair Connects,BEL,Vacuum,Vacuum,34,Philips,"","",Fixed,"",Maakbaar Leuven,2022-08-13,Aan- en uitknop defect
repconn_2162,Repair Connects,BEL,Vacuum,Vacuum,34,Primo,"","",Fixed,"",Repair Café Roeselare,2021-05-05,"Robotstofzuiger helemaal uit elkaar gehaald om schoon te maken, maar roller onderaan zit vast en draait niet meer."
repconn_2163,Repair Connects,NLD,Vacuum,Vacuum,34,AEG,2019,3,Fixed,"",Foenix Repair Café Apeldoorn,2022-07-29,doet opeens niets meer!!
repconn_2164,Repair Connects,BEL,Vacuum,Vacuum,34,Nilfisk,"","",Repairable,"",Repair Café Gent,2022-01-21,Start niet meer
repconn_2165,Repair Connects,NLD,Vacuum,Vacuum,34,Miele,"","",Fixed,"",Foenix Repair Café Apeldoorn,2022-08-02,Start niet meer. Ik heb de stofzuiger al gedemonteerd maar kan niet vaststellen of de motor defect is of dat het iets anders is.
repconn_2166,Repair Connects,BEL,Vacuum,Vacuum,34,Nilfisk,"","",Fixed,"",Repair Café Gent,2022-08-17,"De stofzuiger stopt telkens vanzelf na enkele minuten. Zak, filter, hepafilter zijn al vervangen maar het probleem blijft. Zou de motor kapot zijn? Kan dat ev vervangen worden?"
repconn_2167,Repair Connects,BEL,Vacuum,Vacuum,34,Miele,2005,17,End of life,Item too worn out,Repair Café Gent,2022-01-06,Het toestel werkt maar er komt warme lucht uit en weinig zuigkracht. Volgens meneer van Repair Cagé op Meulestede op 4/12 dient de motor gekuist worden
repconn_2168,Repair Connects,BEL,Vacuum,Vacuum,34,Nilfisk,2019,3,Fixed,"",Maakbaar Leuven,2022-09-16,"De motor start normaal op, maar na x minuten slaat ie af."
repconn_2169,Repair Connects,BEL,Vacuum,Vacuum,34,Nilfisk,"","",Fixed,"",Maakbaar Leuven,2022-08-06,Werkt maar kort
repconn_2170,Repair Connects,BEL,Vacuum,Vacuum,34,Kirby,"","",Fixed,"",Repair Café Mol en Balen,2023-01-22,werkt niet meer
repconn_2171,Repair Connects,BEL,Vacuum,Vacuum,34,Dyson,"","",Repairable,"",Repair Café Virtuel Wallonie/Bruxelles,2021-07-19,"Als we de stofzuiger aandoen, heeft het maar een paar seconden een goede zuigkracht, en dan niet meer."
repconn_2172,Repair Connects,BEL,Vacuum,Vacuum,34,Kirby,"","",Fixed,"",Repair Café Mol en Balen,2023-01-22,werkt niet meer
repconn_2173,Repair Connects,BEL,Vacuum,Vacuum,34,Leifheit,"","",End of life,Item too worn out,Maakbaar Leuven,2022-07-07,Uit elkaar gevallen
repconn_2174,Repair Connects,BEL,Vacuum,Vacuum,34,Philips,"","",Repairable,"",Repair Café Gent,2022-12-06,Foutcode = SE
repconn_2175,Repair Connects,BEL,Vacuum,Vacuum,34,Onbekend,"","",End of life,Item too worn out,Maakbaar Leuven,2022-09-13,Onbekend
repconn_2176,Repair Connects,BEL,Vacuum,Vacuum,34,AEG,"","",Fixed,"",Repair Café Gent,2022-01-20,"Na 2 seconden stofzuigen, valt hij uit en geeft aan dat de batterij plat is, maar eens in de lader is hij nog voor de helft opgeladen en laadt hij niet meer verder op. Na opnieuw aanzetten, houdt hij het opnieuw niet langer dan 2 seconden vol, dit reeds gedurende enkele weken."
repconn_2177,Repair Connects,BEL,Vacuum,Vacuum,34,Philips,"","",Fixed,"",Repair Café Virtuel Wallonie/Bruxelles,2021-06-14,"L'appareil fonctionne toujours en partie. Le problème, c'est qu'il rejette des poussières."
repconn_2178,Repair Connects,BEL,Vacuum,Vacuum,34,Philips,"","",Repairable,"",Maakbaar Leuven,2022-03-30,the mouth of the vacuum cleaner keeps turning in carpet mode (stick to the floor)
repconn_2179,Repair Connects,BEL,Vacuum,Vacuum,34,miele,"","",End of life,Item too worn out,Maakbaar Leuven,2022-09-10,Plots doet hij het niet meer. \r\nTijdens een stofzuigbeurt viel hij uit en wou hij niet meer starten
repconn_2180,Repair Connects,BEL,Vacuum,Vacuum,34,Miele,2016,5,Repairable,"",Maakbaar Leuven,2021-07-16,no. 00/142658892\n2 faults:\n1 won't turn on - suspect switch\n2 cord won't retract - suspect spring broken.
repconn_2181,Repair Connects,BEL,Vacuum,Vacuum,34,Bosch,2020,2,Fixed,"",Maakbaar Leuven,2022-08-14,The vacuum doesn't charge anymore.
repconn_2182,Repair Connects,BEL,Vacuum,Vacuum,34,Miele,2016,7,Fixed,"",Maakbaar Leuven,2023-01-21,Aan / uit knop functioneert niet meer.
repconn_2183,Repair Connects,BEL,Vacuum,Vacuum,34,Samsung,2016,6,Repairable,"",Repair Café Gent,2022-03-24,Zuigt niet goed
repconn_2184,Repair Connects,BEL,Vacuum,Vacuum,34,Rowenta,"","",Fixed,"",Repair Café Mol en Balen,2023-01-22,toestel handstofzuiger rowenta air force 360 het borstelje draaien niet meer rond
repconn_2185,Repair Connects,BEL,Vacuum,Vacuum,34,Karcher,"","",Fixed,"",Repair Café Mol en Balen,2023-01-20,"Werkte goed, het snoer had slecht contact viel soms uit bij rijden van de stofzuiger, en op eens ontplofte deze ergens kortsluiting en sinsdien niet meer in stopcontact gestoken"
repconn_2186,Repair Connects,BEL,Vacuum,Vacuum,34,Philips,2015,7,Fixed,"",Repair Café Gent,2022-09-30,"De stofzuiger gaat niet meer aan. \r\nVoorheen is dat ook al éénmaal gebeurd maar de dag erna werkte hij wel weer.\r\nNu gaat hij al 3 weken na elkaar niet meer.\r\nControle van snoer, filter, stofzak en slang tonen geen probleem."
repconn_2187,Repair Connects,NLD,Vacuum,Vacuum,34,Philips Performer Expert,"","",Fixed,"",Foenix Repair Café Apeldoorn,2022-08-22,Geen contact meer met stroom.\r\nMogelijk breuk in stroomkabel of niet werkend voetcontact aan/uit
repconn_2188,Repair Connects,NLD,Vacuum,Vacuum,34,Philips,"","",Fixed,"",Foenix Repair Café Apeldoorn,2023-01-03,Toestel maakt erg veel lawaai en komt een branderige geur vanaf
repconn_2189,Repair Connects,BEL,Vacuum,Vacuum,34,dyson,"","",Repairable,"",Maakbaar Leuven,2022-11-16,doet niets meer ineens
repconn_2190,Repair Connects,BEL,Vacuum,Vacuum,34,Nilfisk,"","",Fixed,"",Repair Café Gent,2023-01-07,Van de ene op andere dag wil het toestel niet meer starten
repconn_2191,Repair Connects,BEL,Vacuum,Vacuum,34,AEG,"","",Fixed,"",Maakbaar Leuven,2021-06-03,"Deed het lange tijd perfect, relatief weinig gebruikt. Lijkt nu zuigkracht bijna volledig kwijt en de motor maakt luid lawaai bij het aanschakelen. Geen onmiddellijk zichtbare obstructies."
repconn_2192,Repair Connects,NLD,Vacuum,Vacuum,34,Philips,2014,8,Fixed,"",Foenix Repair Café Apeldoorn,2022-08-23,Er is een hapje uit het snoer
repconn_2193,Repair Connects,BEL,Vacuum,Vacuum,34,philips,"","",Fixed,"",Repair Café Mol en Balen,2023-01-20,"stofzuiger werkt soms wel, soms niet. Waarschijnlijk probleem met snoer/kontakt? Start soms en valt daarna uit bv."
repconn_2194,Repair Connects,NLD,Vacuum,Vacuum,34,Hema,"","",Fixed,"",Foenix Repair Café Apeldoorn,2022-09-02,Draaiborstel bij de zuigmond draait niet meer.
repconn_2195,Repair Connects,NLD,Vacuum,Vacuum,34,Philips,2019,3,Fixed,"",Foenix Repair Café Apeldoorn,2022-08-30,"De stekker van de stofzuiger heeft denk ik een kabelbreuk. Echter zit die kabelbreuk helemaal op het begin in de stofzuiger waar je moeilijk bij komt. Wanneer ik stofzuig doet hij het op sommige momenten niet en als ik de kabel iets anders leg, dan wel."
repconn_2196,Repair Connects,BEL,Vacuum,Vacuum,34,Bosch,"","",Fixed,"",Maakbaar Leuven,2022-05-11,"Bij gebruik, geur van kortsluiting kwam uit toestel en werkte niet meer."
repconn_2197,Repair Connects,NLD,Vacuum,Vacuum,34,philips,2014,8,Fixed,"",Foenix Repair Café Apeldoorn,2022-08-31,Aan en uitknop doet het niet meer
repconn_2198,Repair Connects,BEL,Vacuum,Vacuum,34,Aeg,"","",Repairable,"",Repair Café Gent,2023-02-12,"Het toestel was stil en werkte goed, nu is er amper zuigkracht en maakt het veel lawaai"
repconn_2199,Repair Connects,BEL,Vacuum,Vacuum,34,Rowenta,"","",Repairable,"",Repair Café Zuidrand,2022-11-24,"Stukje afgebroken. Heb het onderdeel besteld, maar krijg het zelf niet gemonteerd."
repconn_2200,Repair Connects,BEL,Vacuum,Vacuum,34,AEG,2018,4,Repairable,"",Maakbaar Leuven,2022-12-09,"Deze stofzuiger werkte perfect maar opeens was het gedaan. Er zat overal veel stof, dat werd verwijderd maar nu werkt hij nog niet. Volgens mij laadt hij zich nog op aan de electriciteit...."
repconn_2201,Repair Connects,BEL,Vacuum,Vacuum,34,Rowenta,2019,3,Fixed,"",Maakbaar Leuven,2022-03-20,Geen contact meer met electriciteit
repconn_2202,Repair Connects,BEL,Vacuum,Vacuum,34,Siemens,2002,20,Fixed,"",Repair Café Gent,2022-09-17,"Werkt niet meer, bij nazicht component (condensator, transistor, ...?) los op printplaat. Mogelijks solderen."
repconn_2203,Repair Connects,BEL,Vacuum,Vacuum,34,Miele,"","",Repairable,"",Repair Café Waregem,2023-02-15,Snoer rolt niet meer in
repconn_2204,Repair Connects,BEL,Vacuum,Vacuum,34,Klindo,"","",Fixed,"",Repair Café Roeselare,2022-03-25,Borstel draait niet meer rond
repconn_2205,Repair Connects,NLD,Vacuum,Vacuum,34,Philips,"","",Fixed,"",Foenix Repair Café Apeldoorn,2022-12-15,Bedrading naast stekker is los. De stofzuiger doet het (nog) wel. Maar snoer gaat bijna door.
repconn_2206,Repair Connects,BEL,Vacuum,Vacuum,34,Dyson,2009,12,Repairable,"",Repair Café Gent,2021-11-18,De stofzuiger start niet meer...
repconn_2207,Repair Connects,BEL,Vacuum,Vacuum,34,DYSON,"","",Fixed,"",Maakbaar Leuven,2022-09-09,Ergens geen goed contact waardoor het lichtje regelmatig uitvalt en dat het soms niet oplaadt
repconn_2208,Repair Connects,BEL,Vacuum,Vacuum,34,AEG,"","",Fixed,"",Maakbaar Leuven,2022-09-13,Slecht contact . Lichtje brandt even en valt dan telkens weer uit .
repconn_2209,Repair Connects,BEL,Vacuum,Vacuum,34,Essai,2010,11,End of life,No way to open product,Repair Café Virtuel Wallonie/Bruxelles,2021-09-14,Essai
repconn_2210,Repair Connects,BEL,Vacuum,Vacuum,34,Bosch,"","",Fixed,"",Maakbaar Leuven,2022-09-10,Aan/uit knop werkt niet meer
repconn_2211,Repair Connects,NLD,Vacuum,Vacuum,34,Bosch,2020,2,Fixed,"",Foenix Repair Café Apeldoorn,2022-09-09,"Hij start niet meer. Er leek een klein beetje vocht in te zitten, is nu gedroogd."
repconn_2212,Repair Connects,BEL,Vacuum,Vacuum,34,Irobot,"","",Repairable,"",Repair Café Gent,2021-11-18,Hij geeft foutmeldind 3 bij het opladen. Het lampje flikkert dan ook in het rood. Opladen lukt dan ook niet meer.
repconn_2213,Repair Connects,NLD,Vacuum,Vacuum,34,AEG,"","",Fixed,"",Foenix Repair Café Apeldoorn,2022-09-09,"Hij zuigt moeilijk op, terwijl er wel druk is"
repconn_2214,Repair Connects,BEL,Vacuum,Vacuum,34,Philips,"","",Repairable,"",Maakbaar Leuven,2022-03-31,"De borstel draait niet meer en schakelt automatisch uit. Foutcode E4: ""De borstelrol is verstopt en kan niet meer vrij draaien. Schakel het apparaat uit en controleer of de borstelrol geblokkeerd is."" De borstel is proper (geen haar enz) en is hij goed ingeklikt, dus er lijkt me binnenin iets niet meer te werken."
repconn_2215,Repair Connects,BEL,Vacuum,Vacuum,34,Miele,2018,4,Fixed,"",Maakbaar Leuven,2022-12-10,"Stofzuiger start en valt uit, waarschijnlijk slecht contact met electriciteitskabel"
repconn_2216,Repair Connects,NLD,Vacuum,Vacuum,34,Philips,2019,3,Fixed,"",Foenix Repair Café Apeldoorn,2022-12-07,"De stofzuigermotor gaat wel normaal aan, maar de zuigkracht is verdwenen."
repconn_2217,Repair Connects,BEL,Vacuum,Vacuum,34,Siena,"","",Repairable,"",Repair Café Zuidrand,2022-01-06,"Het toestel start niet meer, na jaren trouwe dienst."
repconn_2218,Repair Connects,BEL,Vacuum,Vacuum,34,Hoover,"","",Fixed,"",Maakbaar Leuven,2022-12-10,"Aan en uitknop, volumeknop functioneert alleen nog sporadisch. Zuigvermogen flink aangetast"
repconn_2219,Repair Connects,BEL,Vacuum,Vacuum,34,Philips,2019,3,Repairable,"",Repair Café Gent,2022-12-06,Geeft foutmelding bij opladen en werkt dus niet meer.
repconn_2220,Repair Connects,BEL,Vacuum,Vacuum,34,stofzuigerrobot van PRIMO,"","",End of life,"",Maakbaar Leuven,2020-05-16,werkt niet meer - lijkt niet meer op te laden
repconn_2221,Repair Connects,BEL,Vacuum,Vacuum,34,Nilfisk,"","",Fixed,"",Maakbaar Leuven,2022-11-30,Gaat niet meer aan
repconn_2222,Repair Connects,BEL,Vacuum,Vacuum,34,AEG,"","",Repairable,"",Maakbaar Leuven,2022-04-09,Na een val wil deze steelstofzuiger niet meer starten. Hij maakt nog heel kort een geluid en valt dan meteen weer stil. Batterij laadt wel nog op en de lampjes werken.
repconn_2223,Repair Connects,BEL,Vacuum,Vacuum,34,Dirt Devil,2019,3,End of life,No way to open product,Maakbaar Leuven,2022-06-04,"Waarschijnlijk probleem in circuit van batterij. Hij start op, maar gaat heel snel leeg. Na een minuut te laten staan start hij weer op, maar slechts op 75% en gaat dan weer heel snel leeg."
repconn_2224,Repair Connects,BEL,Vacuum,Vacuum,34,Hoover,"","",End of life,Spare parts too expensive,Repair for Pepinster (Tienen),2021-09-16,aansluitstuk (in kunststof) van de slang in de behuizing komt los\r\nte kuisen en na te kijken
repconn_2225,Repair Connects,BEL,Vacuum,Vacuum,34,Geen idee,2020,2,End of life,Spare parts too expensive,Maakbaar Leuven,2022-05-14,"Het toestel werkte prima maar, nu wil het niet meer opladen."
repconn_2226,Repair Connects,BEL,Vacuum,Vacuum,34,Miele S8310,2015,7,End of life,Spare parts too expensive,Repair Café Mol en Balen,2022-02-26,Goed er komt damp uit precies of de motor Brandt denk dat er vuil bij de motor zit maar ik kan er niet bij
repconn_2227,Repair Connects,BEL,Vacuum,Vacuum,34,Neato,2017,5,Repairable,"",Maakbaar Leuven,2022-10-23,Erorr 3000
repconn_2228,Repair Connects,NLD,Vacuum,Vacuum,34,Miele,2017,5,Fixed,"",Foenix Repair Café Apeldoorn,2022-02-28,Heeft altijd prima gewerkt maar nu in 1x geen stroom meer
repconn_2229,Repair Connects,BEL,Vacuum,Vacuum,34,AEG,"","",Repairable,"",Maakbaar Leuven,2022-06-09,"De motor/batterij van het toestel werkt niet meer mee. Als ik hem aanzet, valt hij na een aantal seconden vanzelf weer uit. Het probleem doet zich alleen voor als we de stofzuiger in zijn geheel gebruiken: het kruimeldiefgedeelte afzonderlijk doet het wel nog."
repconn_2230,Repair Connects,BEL,Vacuum,Vacuum,34,Miele,2019,3,End of life,Spare parts too expensive,Maakbaar Leuven,2022-05-25,While vacuuming some dust the bag misaligned and the dust got in the engine or fan. It's super loud now.
repconn_2231,Repair Connects,BEL,Vacuum,Vacuum,34,Dyson,"","",Repairable,"",Maakbaar Leuven,2022-09-08,Zuigkracht is sterk verminderd
repconn_2232,Repair Connects,BEL,Vacuum,Vacuum,34,Onbekend,"","",Fixed,"",Maakbaar Leuven,2022-09-13,Onbekend
repconn_2233,Repair Connects,BEL,Vacuum,Vacuum,34,Dyson,2016,5,Fixed,"",Repair Café Waregem,2021-06-28,Productiejaar : niet zeker. Wel aangekocht in 2016\r\n1) van bij begin aankoop liep batterij vlug leeg - dus konden we niet lang stofzuigen\r\n2) nu laadt het helemaal niet meer
repconn_2234,Repair Connects,NLD,Vacuum,Vacuum,34,Miele,"","",Fixed,"",Foenix Repair Café Apeldoorn,2022-09-16,Er is waarschijnlijk sprake van een kabelbreuk in het oprolsysteem van de Miele s2461 Air Clean Plus stofzuiger.
repconn_2235,Repair Connects,BEL,Vacuum,Vacuum,34,Dirt devil,"","",End of life,Spare parts too expensive,Repair Café Mol en Balen,2022-09-04,Stofzuiger heeft altijd goed gewerkt. Zelfs als de stofzuiger opgeladen is valt hij regelmatig uit terijkw de batterij nog voldoende opgeladen is. Na een tijdje start hij opnieuw en kan ik een beetje verder doen en valt dan weer stil.
repconn_2236,Repair Connects,BEL,Vacuum,Vacuum,34,Karcher,"","",Fixed,"",Repair Café Mol en Balen,2022-07-24,De motor werkt niet meer. De stofzuiger stopt al snel na het aanzetten.
repconn_2237,Repair Connects,NLD,Vacuum,Vacuum,34,Bosch,"","",Fixed,"",Foenix Repair Café Apeldoorn,2022-09-19,Het zelfreinigende systeem gaat iederen minuut aan.
repconn_2238,Repair Connects,NLD,Vacuum,Vacuum,34,miele,"","",Fixed,"",Foenix Repair Café Apeldoorn,2022-09-19,De stofzuiger stopte met zuigen en stonk naar rook. We denken dat er rommel in het motortje zit.
