id,data_provider,country,partner_product_category,product_category,product_category_id,brand,year_of_manufacture,product_age,repair_status,repair_barrier_if_end_of_life,group_identifier,event_date,problem
repconn_1353,Repair Connects,BEL,Printer/scanner,Printer/scanner,25,Epson,"","",Repairable,"",Repair Café Waregem,2021-05-19,"Bonjour !\r\nMon imprimante n’est plus utilisée depuis 1 ou 2 ans. Au début elle sortait que des pages blanches. Puis j’ai effectuée plusieurs fois les programme de maintenance de nettoyage des têtes d’impression et de vérification des buses. J’ai attendu 1 jour puis au changé les cartouches et elle a finit pas imprimer mais elle n’imprime qu’en rose et bleu, les cartouches jaune et noir sont pourtant neuves. J’ai refais beaucoup de fois les programmes de maintenance mais elle n’imprime toujours qu’en rose et bleu. Des idées ?\r\nMerci d’avance :)"
repconn_1354,Repair Connects,BEL,Printer/scanner,Printer/scanner,25,HP Deskjet,"","",Fixed,"",Maakbaar Leuven,2021-12-22,"Bij het afprinten, slaat hij op regelmatige basis een lijn of meerdere lijnen over.\r\nWe ( zoon ) hebben al geprobeerd de kop te reinigen maar dit lukt niet"
repconn_1355,Repair Connects,BEL,Printer/scanner,Printer/scanner,25,HP,2018,4,Fixed,"",Maakbaar Leuven,2022-03-02,papierstoring; deel van papier is achtergebleven in printer en niet te zien; foutmelding bij printen
repconn_1356,Repair Connects,BEL,Printer/scanner,Printer/scanner,25,HP,"","",End of life,"",Maakbaar Leuven,2022-03-12,Het toestel start niet meer op. Het lijkt alsof het geen stroom krijgt wanneer het ingeplugd is.
repconn_1357,Repair Connects,BEL,Printer/scanner,Printer/scanner,25,Samsung,2013,8,End of life,"",Repair Café Kruisem,2021-05-04,De printer pakt het papier niet meer op.
repconn_1358,Repair Connects,BEL,Printer/scanner,Printer/scanner,25,Canon Pixma,"","",Fixed,"",Maakbaar Leuven,2021-01-28,"De printer start niet meer op. Voedingskabel is ok, ik vermoed probleem in voedingsmodule. Eventueel slecht contact in aan/uit-knop."
repconn_1359,Repair Connects,BEL,Printer/scanner,Printer/scanner,25,hp,"","",End of life,Item too worn out,Maakbaar Leuven,2021-11-27,"foutmelding printkop ontbreekt, terwijl dat ervoor helemaal goed werkte"
repconn_1360,Repair Connects,BEL,Printer/scanner,Printer/scanner,25,Canon,2010,11,End of life,Item too worn out,Maakbaar Leuven,2021-12-21,"Na het aanzetten geeft de printer verschillende ERROR berichten. Soms ""Printkop onjuist,"" soms codes zonder uitleg. Hij doet niets anders meer, geeft geen menu meer aan, print en scant niet meer. We hebben hem zelf al eens geopend, schoongemaakt en geprobeerd te doen werken. Tijdelijk deed hij het weer, maar dat is nu weer voorbij."
repconn_1361,Repair Connects,BEL,Printer/scanner,Printer/scanner,25,HP,2011,10,Fixed,"",Maakbaar Leuven,2021-01-31,"Toestel werkte perfect. Bij het uithalen van een inktpatroon, bleef dit steken (geraakte er echt niet uit) en moet er iets geforceerd zijn door het er toch uit te halen. Nu geraakt er geen nieuw patroon meer in."
repconn_1362,Repair Connects,BEL,Printer/scanner,Printer/scanner,25,Brother,"","",Fixed,"",Repair Café Roeselare,2021-12-01,Papier blijft steeds vaststeken bij printen
repconn_1363,Repair Connects,BEL,Printer/scanner,Printer/scanner,25,Epson,2018,4,End of life,Item too worn out,Maakbaar Leuven,2022-06-04,"Foutcode E08 - absorptiekussens vol - deze uitgewassen, gedroogd en teruggeplaatst - printer heeft reset nodig ... volgens Youtube door stop en power gelijk in te drukken en dan 5x stop, maar dit lukt niet - E08 blijft. Ken jij nog een trucje om deze printer weer aan de praat te krijgen?"
repconn_1364,Repair Connects,BEL,Printer/scanner,Printer/scanner,25,Canon,"","",End of life,Item too worn out,Maakbaar Leuven,2021-11-13,Printer neemt steeds een hele stapel papier tegelijk. 1 per 1 lukt niet meer.
repconn_1365,Repair Connects,BEL,Printer/scanner,Printer/scanner,25,HP,"","",Fixed,"",Maakbaar Leuven,2021-02-14,"De printer print telkens in strepen, zowel bij foto’s als teksten, in kleur en zwart/wit. Ik heb al de testjes gedaan via de website maar krijg het niet gefixt."
repconn_1366,Repair Connects,BEL,Printer/scanner,Printer/scanner,25,HP,2010,12,End of life,Item too worn out,Maakbaar Leuven,2022-05-09,"het is tweedehand toestel, ik heb geen nieuw toner gekocht omdat ik ben niet zeker als toestel werkt!"
repconn_1367,Repair Connects,BEL,Printer/scanner,Printer/scanner,25,Onbekend,"","",End of life,Item too worn out,Maakbaar Leuven,2022-09-13,Onbekend
repconn_1368,Repair Connects,BEL,Printer/scanner,Printer/scanner,25,Canon,"","",Fixed,"",Maakbaar Leuven,2021-03-16,"De printer kan geen papier meer nemen. Wanneer je iets wilt laten printen, hoor je dat de printer het papier probeert te nemen, maar verder gebeurd er niets. Na een tijdje zegt de printer dat het papier op is, terwijl er wel voldoende papier in de lade ligt."
repconn_1369,Repair Connects,CHE,Printer/scanner,Printer/scanner,25,Lexmark,2018,3,Fixed,"",Repair Café Frauenfeld,2021-03-11,"ich habe den Drucker von einer guten Kollegin erhalten, es war der Drucker ihres verstorbenen Mami's. Zu beginn druckte dieser einwandfrei, ich habe ihn aber nicht sonderlich viel benutzt. Als ich ihn dann wieder einmal nutzen wollte, hat er ganz schlechte und mit Toner verschmierte Kopien gemacht. Er war immer am Strom. Es wäre mir ein grosses Anliegen, wenn ich den Drucker noch weiter benutzen könnte, schon im Hinblick auf die Erinnerungen an meiner Kollegin ihres verstorbenes Mami."
repconn_1370,Repair Connects,BEL,Printer/scanner,Printer/scanner,25,Canon,"","",End of life,Repair information not available,Maakbaar Leuven,2021-06-08,"Het werkte normaal. 1ste probleem: printte eerste een paar kleuren niet, dan helemaal niet meer."
repconn_1371,Repair Connects,BEL,Printer/scanner,Printer/scanner,25,HP,"","",End of life,Repair information not available,Maakbaar Leuven,2022-03-26,Het toestel start niet meer op. Het lijkt alsof het geen stroom krijgt wanneer het ingeplugd.
repconn_1372,Repair Connects,BEL,Printer/scanner,Printer/scanner,25,dell 1235cn,"","",End of life,Repair information not available,Maakbaar Leuven,2022-10-31,inkt vernieuwd/imagine drum vernieuwd... \r\nlukt niet om te printen
repconn_1373,Repair Connects,BEL,Printer/scanner,Printer/scanner,25,Brother,2020,2,Repairable,"",Repair Café Gent,2022-12-06,"Toen ik maandagmorgen het toestel opstartte stond er plots een foutmelding ""installeer tonercassette"". Nochtans zitten alle toners erin en is er geen enkele leeg. Ik heb alle toners meerdere keren eruit gehaald en er weer in gestopt; stroom uitgetrokken; e.d. maar de foutmelding blijft. Het toestel is helaas 5 maanden buiten garantie ... zal wel weer toeval zijn zeker?"
repconn_1374,Repair Connects,CHE,Printer/scanner,Printer/scanner,25,HP,2016,6,End of life,Repair information not available,Repair Café Frauenfeld,2022-08-03,"Hat bis vor kurzem einwandfrei funktioniert. Wir haben die Tintenpatronen gewechselt und erhalten nun die Fehlermeldung: ""Problem mit dem Drucker oder Tintensystem, Drucker ein- und ausschalten"", Drucken tut er nicht mehr, ein und aus haben wir gemacht."
repconn_1375,Repair Connects,BEL,Printer/scanner,Printer/scanner,25,Brother,"","",End of life,Repair information not available,Maakbaar Leuven,2022-08-18,"Laserprinter werkte perfect tot de dag dat ik mijn wifiwachtwoord van het netwerk heb veranderd. Ik wou dit aanpassen in de instellingen in het menu van de printer, maar klikte op de verkeerde instelling (iets met 'herstel' in plaats van 'installatie wizard' onder de categorie 'WLAN'). Sindsdien reageert de printer op geen enkele bedieningsknop meer, ook niet op de aan- en uitknop. De melding 'wachten aub' blijft zelfs na weken staan. Ik heb reeds de fabrikant gecontacteerd en de handleiding geraadpleegd, maar volgens beiden bestaat de functie 'herstel' niet in het menu, maar ik heb dit wel degelijk aangeklikt."
repconn_1376,Repair Connects,BEL,Printer/scanner,Printer/scanner,25,HP Deskjet 3520/3524 e-All-in-one SERIES,2018,5,Repairable,"",Repair Café Zuidrand,2023-01-16,Het print niet volledig
repconn_1377,Repair Connects,CHE,Printer/scanner,Printer/scanner,25,HP Office Jet Pro 8600,2018,4,End of life,Repair information not available,Repair Café Frauenfeld,2022-09-23,"Es kommt die Fehlermedung\r\nProblem mit Drucker oder Tintensystem\r\nSupport meinte keine Hilfe mehr möglich da 4 Jahre alt..\r\nHabe nur Originaltinten benutzt. Auch diese ausgetauscht... Internet sagt, putzen, reseten, Software updaten.- nichts geholfen. Weiss nicht ob er noch Change zu überleben hätte. Auf Ricardo gibts einige mit genau der gleichen Fehlermeldung... \r\nVielleicht kennt die jemanden und kennt den mir nicht bekannten Trick 77:)\r\nDanke"
repconn_1378,Repair Connects,NLD,Printer/scanner,Printer/scanner,25,Canon,"","",Repairable,"",Foenix Repair Café Apeldoorn,2022-04-25,Eerst goed. Nu probleem met papierdoorvoer. Los onderdeel gevonden. Lijkt niet beschadigd.
repconn_1379,Repair Connects,BEL,Printer/scanner,Printer/scanner,25,HP,"","",End of life,No way to open product,Repair Café Zuidrand,2022-05-16,Het toestel drukt niet meer af. Melding: geen papier. De lade bevat wel papier.
repconn_1380,Repair Connects,CHE,Printer/scanner,Printer/scanner,25,Hewlett-Packard,2007,15,Repairable,"",Repair Café Frauenfeld,2022-10-24,Plötzlich den Geist aufgegeben. Auch grüne Leuchtdiode leuchtet nicht mehr. Vielleicht interne Sicherung ?
repconn_1381,Repair Connects,NLD,Printer/scanner,Printer/scanner,25,Epson,"","",Repairable,"",Foenix Repair Café Apeldoorn,2022-11-07,Op een bepaald moment werden afdrukken wazig (deels). Lijkt met kalibratie of uitlijning te maken te hebben...??
repconn_1382,Repair Connects,BEL,Printer/scanner,Printer/scanner,25,CANON PIXMA,2015,7,End of life,No way to open product,Repair Café Aalter,2022-09-04,Het toestel neemt geen papier op.
repconn_1383,Repair Connects,BEL,Printer/scanner,Printer/scanner,25,Canon TS 3350,"","",Repairable,"",Maakbaar Leuven,2022-09-20,Er is een foutmelding waarschijnlijk heft het te maken met de aansluiting. Het oranje lampje bij het driehoekje brandt.
repconn_1384,Repair Connects,BEL,Printer/scanner,Printer/scanner,25,Brother,2006,15,Fixed,"",Repair Café Virtuel Wallonie/Bruxelles,2021-06-16,"Dans le passé il fonctionnait très bien. Appareil dûment utilisé.\nActuellement, problème de tambour. Notification pc : changer le tambour. Depuis 3 jours, l'imprimante ne fonctionne plus."
repconn_1385,Repair Connects,NLD,Printer/scanner,Printer/scanner,25,Canon,"","",Repairable,"",Foenix Repair Café Apeldoorn,2022-11-03,De micro-usb aansluiting is losgekomen van het bord toen de usb kabel eruit werd getrokken. Ik krijg deze niet meer werkend terug.
repconn_1386,Repair Connects,BEL,Printer/scanner,Printer/scanner,25,Epson,2015,6,End of life,Spare parts not available,Maakbaar Leuven,2021-09-11,De zwarte kleur drukt niet meer af.
repconn_1387,Repair Connects,BEL,Printer/scanner,Printer/scanner,25,Canon,2013,8,Fixed,"",Maakbaar Leuven,2021-05-16,Het papiertransport werkt niet meer goed. Voor de rest is alles nog in orde. De bedoeling is om het toestel werkend weg te geven of aan het Spit te bezorgen. Er zijn ook nog ongebruikte inktcassettes bij.
repconn_1388,Repair Connects,NLD,Printer/scanner,Printer/scanner,25,HP,"","",Repairable,"",Foenix Repair Café Apeldoorn,2022-04-25,"Hij print nog wel als het online wordt aangeleverd: laptop, pc of telefoon. \r\nHij scant niet meer en maakt zelf geen kopie meer bij invoer op het apparaat."
repconn_1389,Repair Connects,BEL,Printer/scanner,Printer/scanner,25,Brother,"","",Repairable,"",Maakbaar Leuven,2022-09-24,Werkte prima maar recent geen respons meer: lijkt alsof er geen stroomtoevoer meer is....
repconn_1390,Repair Connects,BEL,Printer/scanner,Printer/scanner,25,Brother,2018,3,Fixed,"",Maakbaar Leuven,2021-05-26,"Beste\nTot nu toe printte die perfect met een namaak toner TN2410 maar ineens zegt die "" Cannot detect Put the toner cartridge back in"". Ik heb een nieuwe gestoken en ook hiermee zegt hij dit.\nIk durf niet zo goed een originele toner te gaan kopen want als er echt iets is met de printer ben ik dat geld ook nog kwijt.\nMisschien kunnen jullie mij helpen?\nAlvast bedankt."
repconn_1391,Repair Connects,BEL,Printer/scanner,Printer/scanner,25,Brother,"","",Repairable,"",Maakbaar Leuven,2022-11-29,"Pakt geen papier meer, je hoort het machine wel draaien maar hij pakt geen papier"
repconn_1392,Repair Connects,BEL,Printer/scanner,Printer/scanner,25,Brother,"","",Repairable,"",Maakbaar Leuven,2022-09-08,Neemt geen papier op
repconn_1393,Repair Connects,BEL,Printer/scanner,Printer/scanner,25,Canon inktjetprinter,"","",Repairable,"",Maakbaar Leuven,2022-09-10,aan-uit schakelaar vermoedelijk defect.
repconn_1394,Repair Connects,BEL,Printer/scanner,Printer/scanner,25,HP,2018,5,Repairable,"",Repair Café Gent,2023-01-16,"alle lichtjes knipperen tegelijk, lijkt iets mis met transfo, veranderen van stopcontact en lange tijd zonder stroom helpt niet. Het is geen gekende error code volgens de handleiding en website van HP."
repconn_1395,Repair Connects,BEL,Printer/scanner,Printer/scanner,25,HP Officejet 6500A,2019,3,Repairable,"",Repair Café Gent,2022-12-06,"Het toestel geeft telkens de foutmelding 'plaats papier in de printer' terwijl dat er voldoende papier aanwezig is, printen gaat niet meer, je hoort het rolletje draaien dat papier wil nemen, maar dan stopt het"
repconn_1396,Repair Connects,BEL,Printer/scanner,Printer/scanner,25,hp,"","",Repairable,"",Repair Café Gent,2022-01-19,Zelfs bij nieuwe cartridge print hij nog altijd niet duidelijk
repconn_1397,Repair Connects,BEL,Printer/scanner,Printer/scanner,25,Brother,"","",Repairable,"",Repair Café Gent,2021-11-18,Kan cyaan inkt niet detecteren (ook niet bij nieuw inktpatroon).
repconn_1398,Repair Connects,BEL,Printer/scanner,Printer/scanner,25,EPSON,"","",Repairable,"",Repair Café Gent,2021-11-18,probleem met de inkttoevoer en vervanging van inktpatronen
repconn_1399,Repair Connects,BEL,Printer/scanner,Printer/scanner,25,Canon,"","",Repairable,"",Repair Café Gent,2021-11-18,Wil niet meer aan.
repconn_1400,Repair Connects,NLD,Printer/scanner,Printer/scanner,25,Samsung,2012,10,Repairable,"",Foenix Repair Café Apeldoorn,2022-08-31,"Na het aanzetten brandt er alleen een oranje lampje, verder gebeurt er niks meer"
repconn_1401,Repair Connects,NLD,Printer/scanner,Printer/scanner,25,Canon Pixma MG 7550,2017,5,Repairable,"",Foenix Repair Café Apeldoorn,2022-11-17,"Tekeningen zijn niet scherp, tekst is om de 3 regels vaag."
repconn_1402,Repair Connects,NLD,Printer/scanner,Printer/scanner,25,HP,2018,3,Repairable,"",Foenix Repair Café Apeldoorn,2021-08-10,De printer blijft continu leeg papier uitwerpen tot dat het papier op is.
repconn_1403,Repair Connects,BEL,Printer/scanner,Printer/scanner,25,HP,"","",Repairable,"",Maakbaar Leuven,2021-08-02,Past week
repconn_1404,Repair Connects,BEL,Printer/scanner,Printer/scanner,25,canon pixma mg5650,2016,5,Repairable,"",Repair Café Gent,2021-11-18,"print dubbele letters , tekst moeilijk leesbaar\nprintkop uitgbouwd en gereinigd, printer gereset, driver vewijderd en opnieuw geinstalleerd.\nDesktop HPE 310 be, win 10 pro"
repconn_1405,Repair Connects,BEL,Printer/scanner,Printer/scanner,25,Canon,2016,5,Repairable,"",Repair Café Virtuel Wallonie/Bruxelles,2021-04-30,"L'imprimante fonctionnait très bien, parfois elle bourrait. A présent, elle ne veut pas prendre le papier."
repconn_1406,Repair Connects,BEL,Printer/scanner,Printer/scanner,25,HP,2008,14,Repairable,"",Repair Café Gent,2022-04-02,mogelijks wordt het papier niet meer opgenomen door kapotte motor of ander probleem.
repconn_1407,Repair Connects,NLD,Printer/scanner,Printer/scanner,25,samsung,2015,7,Repairable,"",Foenix Repair Café Apeldoorn,2022-12-13,papier transport door de printer doet het niet meer door een kapotte geleidingsstang.
repconn_1408,Repair Connects,BEL,Printer/scanner,Printer/scanner,25,Samsung,2009,12,Repairable,"",Repair Café Gent,2021-10-29,Toestel werkt nog perfect maar ik moet pagina per pagina inleggen omdat hij anders meerdere pagina's tegelijk doortrekt en daardoor vastloopt.
repconn_1409,Repair Connects,BEL,Printer/scanner,Printer/scanner,25,brother,2009,12,Repairable,"",Repair Café Gent,2021-10-29,"Toestel heeft 5 tal jaar stil gestaan. \nAlle elektronica en het printen zelf werken nog maar niet alle kleuren komen nog door de printkop. Vermoedelijk een verstopte toevoer. \nOp Youtube zijn verschillende filmpjes te vinden om deze te kuisen met heet water en een spuitje met buisje, maar ik ontzie het mij. \nhttps://www.youtube.com/watch?v=XERkJO7KlUI&ab_channel=Matitiasz\n\nIemand die dit eens kan uitproberen of eventuele andere oorzaken van het probleem bekijken ? \n\nmvg"
repconn_1410,Repair Connects,BEL,Printer/scanner,Printer/scanner,25,xerox,2004,17,Repairable,"",Repair Café Gent,2021-10-29,"Printer slaat aan, maar stopt steeds met de melding dat er een ventilator niet werkt. Echter al eens gecontroleerd en een nieuw geplaatst. Maar blijft steeds steeds hetzelfde euvel aangeven...\r\nDe printer staat nu al 8jaar op straf. Hopelijk is dit geen probleem.\r\nIndien niet gemaakt kan worden gaat ie naar het stort, maar zou het zonde vinden."
repconn_1411,Repair Connects,BEL,Printer/scanner,Printer/scanner,25,Canon,"","",Repairable,"",Repair Café Gent,2022-12-06,Onmiddellijk na het inschakelen van het toestel wordt er een foutcode getoond zonder mogelijkheid om verder te gaan.
repconn_1412,Repair Connects,NLD,Printer/scanner,Printer/scanner,25,Epson,2018,4,Repairable,"",Foenix Repair Café Apeldoorn,2022-08-22,een aantal jaar geleden heb ik een epson printer ET-2600 gekocht. Een duurder model want groter inktvullingen en dus kon ik er langer mee doen zei de verkoper. Tot op heden veel plezier van gehad. Nu print de printer bijna geen kleur en al helemaal geen zwart. Alle inktpatronen zijn voldoende gevuld. Ik zou de printer graag laten repareren.
repconn_1413,Repair Connects,BEL,Printer/scanner,Printer/scanner,25,HP,2016,6,Fixed,"",Repair Café Gent,2022-03-27,tt
repconn_1414,Repair Connects,BEL,Printer/scanner,Printer/scanner,25,Canon,"","",Repairable,"",Repair Café Gent,2021-07-08,Print niet meer goed
repconn_1415,Repair Connects,BEL,Printer/scanner,Printer/scanner,25,Canon (pixma),2014,8,Repairable,"",Repair Café Waregem,2022-12-26,"Hij print en draait nog, scant ook nog. \r\nEnkel draaien de wieletjes maar neemt hij geen bladeren mee wanneer deze draaien.\r\nHij neemt dus geen papier meer uit de lade, maar blijft gewoon draaien en denkt dat het papier op is."
repconn_1416,Repair Connects,BEL,Printer/scanner,Printer/scanner,25,HP,2013,9,Fixed,"",Maakbaar Leuven,2022-04-09,De printerkop is defect
repconn_1417,Repair Connects,BEL,Printer/scanner,Printer/scanner,25,meanwell,2018,4,Repairable,"",Maakbaar Leuven,2022-09-24,l'alimentation a cesse de fonctionner d'un coup...
repconn_1418,Repair Connects,NLD,Printer/scanner,Printer/scanner,25,Canon,2000,21,Repairable,"",SAZ Repair Café Zuidplas,2021-07-19,"Bij inschakelen maakt het toestel lawaai, en werkt niet meer"
repconn_1419,Repair Connects,BEL,Printer/scanner,Printer/scanner,25,HP,2016,6,Fixed,"",Maakbaar Leuven,2022-07-03,We hebben een nieuwe cartridge geplaatst en de printer blokkeert;
repconn_1420,Repair Connects,BEL,Printer/scanner,Printer/scanner,25,HP,2016,6,Fixed,"",Maakbaar Leuven,2022-07-04,We hebben een cardtridge vervangen en de printer blokkeert.
repconn_1421,Repair Connects,BEL,Printer/scanner,Printer/scanner,25,HP,"","",Repairable,"",Maakbaar Leuven,2022-03-12,Printer print niet langer recto verso. Ook neemt het geen inkt cartridge meer aan die ik net vervangen heb.
repconn_1422,Repair Connects,BEL,Printer/scanner,Printer/scanner,25,HP Deskjet 3520/3524 e-All-in-one SERIES,"","",Repairable,"",Repair Café Zuidrand,2022-05-16,Het probleem nu is dat er bepaalde lijnen geen inkt wordt gedrukt. heb een foto bijgevoegd van het probleem.
repconn_1423,Repair Connects,BEL,Printer/scanner,Printer/scanner,25,Canon,"","",Repairable,"",Repair Café Waregem,2021-05-19,"Bonjour !\r\nElle a toujours très bien marché. Mais je ne l’ai pas utilisé depuis environ 2 ans. Quand j’ai voulu la réutiliser j’ai essayé de mettre du papier mais je me suis trompée ce n’était pas le bon format. Ça n’a donc pas lancé l’impression. Mais une fois avoir changé pour le bon format, l’écran m’a indiqué que la cartouche d’encre n’était pas au bon format alors que si je n’y ai pas touché depuis 2 ans. Elle est sûrement sèche depuis mais ça devrai malgré tout lancer l’impression ou me dire que la cartouche et juste vide non ?\r\nMerci d’avance :)"
repconn_1424,Repair Connects,BEL,Printer/scanner,Printer/scanner,25,Brother,"","",Repairable,"",Repair Café Gent,2022-06-26,reinigen onmogelijk 46
repconn_1425,Repair Connects,BEL,Printer/scanner,Printer/scanner,25,HP,2015,7,Repairable,"",Maakbaar Leuven,2022-03-10,"plots foutmelding : ""printkop ontbreekt, wordt niet gedetecteerd of is onjuist geïnstalleerd""\r\ngebeurde tijdens 2 printopdrachten : eerste geraakte geprint, 2de niet meer\r\ngeen manipulatie van papier of deksel\r\nverschillende keren andere cartridges geprobeerd, gereset, update => geen effect"
repconn_1426,Repair Connects,BEL,Projector,Projector,26,Reflecta,1983,40,End of life,Item too worn out,Maakbaar Leuven,2023-01-28,schuiflader zit vast
repconn_1427,Repair Connects,BEL,Projector,Projector,26,Chinon,1970,51,Fixed,"",Repair Café Gent,2021-08-09,"Er is super 8 film in het toestel dat we er niet meer uit krijgen. Lijkt ergens vastgeplakt te zitten, waarschijnlijk door oververhitting zit het ergens versmolten."
repconn_1428,Repair Connects,CHE,Projector,Projector,26,EPSON,2014,7,End of life,Spare parts too expensive,Repair Café Frauenfeld,2021-11-30,"Beim Einschalten vom Gerät hört man leichte Geräusche, dann das Surren vom Lüfter und anschliessend blinken die LED’s „LAMP“ & „TEMP“ rot… kein Bild erscheint ( ähnlich wie hier beschrieben: http://www.hifi-forum.de/viewthread-94-15439.html)\nDie Lampe wurde bereits ersetzt, hat aber keine Verbesserung gebracht. Das Gerät ist sehr sauber, da es in einem Raum mit wenig Staub betrieben wurde. Alternative zu ihrem Café wäre: www.esag.ch als ""Service-Partner epson in der Schweiz"" - ist aber nicht sicher ob Sie es reparieren können."
repconn_1429,Repair Connects,BEL,Projector,Projector,26,Chinon,1970,51,Fixed,"",Repair Café Gent,2021-08-11,"Er is super 8 film in het toestel dat we er niet meer uit krijgen. Lijkt ergens vastgeplakt te zitten, waarschijnlijk door oververhitting zit het ergens versmolten. Ik heb nog de originele (Engelstalige) handleiding van het toestel. Hierin staat naast hoe het toestel dient gebruikt te worden, ook beschreven hoe het toestel moet geopend en onderhouden worden, bv. voor vervanging van de lamp, lensreiniging en zekeringvervanging. Een schematisch diagram zit er ook bij."
repconn_1430,Repair Connects,BEL,Projector,Projector,26,GAF diaprojector (view master),1984,38,Fixed,"",Repair Café Roeselare,2022-02-16,diaprojector - lamp werkt maar het toestel kan de dia niet meer inschuiven - zit vast
repconn_1431,Repair Connects,BEL,Projector,Projector,26,Diaprojector,"","",Fixed,"",Repair Café Mol en Balen,2022-08-30,Dia's worden niet meer ingeschoven
repconn_1432,Repair Connects,BEL,Projector,Projector,26,epson,"","",Repairable,"",Maakbaar Leuven,2022-08-18,"Ik heb een beamer en een versterker warvan de HDMI aansluitingen niet meer werken. Waarschijnlijk is er een stroomstoot geweest, waardoor de hdmi van zowel de versterker als de beamer niet meer functioneren. Het gekke is, dat de beamer wel nog werkt via VGA (en dus ook met een koppelstukje van VGA-hdmi)...\nEcht handig is dat niet, want zo kan je maar 1 apparaat aansluiten (en ook geluid apart).\n\nOok de afstandsbediening wil niet meer :-("
repconn_1433,Repair Connects,BEL,Projector,Projector,26,Optoma,"","",Fixed,"",Repair Café Gent,2022-01-31,Eennhdmi poort is als gevolg van veel trek en duw manoeuvres over de jaren slecht contact gaan maken. Ik vroeg me af of dat mogelijl te herstellen is bij jullie.
repconn_1434,Repair Connects,CHE,Projector,Projector,26,Epson,2016,6,End of life,Repair information not available,Repair Café Frauenfeld,2022-08-03,Bis vor kurzem in unregelmässigem Gebrauch; während Beamen hat das Gerät ausgeschaltet und es leuchtet nun keine LED-Anzeige mehr. Scheint nicht mehr mit Strom versorgt zu werden
repconn_1435,Repair Connects,BEL,Projector,Projector,26,Epson,"","",Repairable,"",Maakbaar Leuven,2022-11-10,Het lichtje 'lamp too hot' brandt bij het opstarten van de beamer. De beamer voelt helemaal niet warm aan en projecteert niet.
repconn_1436,Repair Connects,BEL,Projector,Projector,26,Bauer,1970,52,Fixed,"",Repair Café Gent,2022-07-13,Ik heb een film kunnen opstarten maar na 1 minuut viel de lamp uit. Ik ben op 7 juli naar het repair café in Gentbrugge geweest. Daar is het toestel geopend en is vastgesteld dat de lamp kapot is en de bedrading naar de lamp verstorven is.
repconn_1437,Repair Connects,BEL,Projector,Projector,26,EUMIG,"","",Repairable,"",Maakbaar Leuven,2020-11-04,Defect: lamp functioneert niet meer + vraag of het “stukje” aan lamp ook niet stuk is gezien ik geen defect kan waarnemen in de lamp (zie foto’s)\nHebben jullie een idee waar ik deze vervangingsstukken kan aankopen?\nBedankt voor deze informatie. Ik stuur je enkele foto’s op met de lamp en het stukje dat vermoedelijk er voor zorgt dat de lamp niet werkt.
repconn_1438,Repair Connects,BEL,Projector,Projector,26,Liesegang,"","",Fixed,"",Maakbaar Leuven,2022-10-23,Inschuifmechanisme van dia's stopt niet
repconn_1439,Repair Connects,BEL,Projector,Projector,26,starshore,2015,7,Fixed,"",Repair Café Aalter,2022-10-24,"soms heel sterk beginnen, en dan verzwakt het.\r\nmeestal geeft het niets .\r\n(gekocht in hubo)"
